created_at,username,sentiment_text,url,subject_tag,stance_category,final_text
2026-03-06T15:00:18.380Z,publicnewsfeed,"Iranian and Israeli strikes as war enters seventh dayThe Iran war, which has spread across the Middle East and beyond, entered its seventh day after Israeli forces announced a &quot;next phase&quot; in the conflict and bombed Beirut&#39;s southern suburbs.https://www.rte.ie/news/2026/0306/1561922-iran-war-update/#IranWar #News #IsraelNews #IranNews #Israel #Iran",https://mastodon.social/@publicnewsfeed/116182824934779731,General Conflict,Neutral,iranian israeli strike war enters seventh day iran war spread across middle east beyond entered seventh day israeli force announce next phase conflict bomb beirut southern suburb
2026-03-06T14:57:13.507Z,DrALJONES,"Report: US investigators say the US military probably carried out the double-tap strike that killed 165, mostly young girls, at an Iranian elementary school.A &quot;double-tap strike&quot; kills one group, then waits for medics &amp; other civilians to arrive in order to kill them as well.https://www.middleeasteye.net/news/us-investigators-say-american-strike-most-likely-responsible-iranian-school-massacre #USWarCrimes #USPol #EUPol #IranWar #IranSchoolAttack #news .",https://mastodon.social/@DrALJONES/116182812819403336,Military Action,Pro-Iran,report u investigator say u military probably carry double tap strike kill mostly young girl iranian elementary school double tap strike kill one group wait medic amp civilian arrive order kill well
2026-03-06T14:50:59.000Z,ai6yr,BBC: Oil price jumps after Qatar warns all Gulf production could stop within dayshttps://www.bbc.com/news/articles/cy031ylgepro#economy #IranWar #gasoline,https://m.ai6yr.org/@ai6yr/116182788285956985,General Conflict,Neutral,bic oil price jump qatar warn gulf production could stop within day
2026-03-06T14:47:44.000Z,ScottLucas,EA on International Media: US and #Israel Expand Their Wars in #Iran and #Lebanon — But How They Will End Them?#IranWar #Trump #SaudiArabia #UAE #Bahrain #Kuwait #Oman #Lebanonhttps://eaworldview.com/2026/03/us-and-israel-wars-iran-and-lebanon-but-how-they-will-end-them/,https://journa.host/@ScottLucas/116182775549206144,General Conflict,Neutral,international medium u expand war end
2026-03-06T14:46:28.445Z,arniedxer.bsky.social,"11575 kHz: there's a new frequency for Radio Farda, 10kHz audio bandwidth like on // 5860, so likely via #USAGM Kuwait. No #jamming; // 13755 UAE is strongly #jammed, + TDF DRM is on 13760.  QRM on 11575 is from SuperDARN, unrelated. #shortwave #Iran #IranWar #WARINIRAN",https://fed.brid.gy/r/https://bsky.app/profile/did:plc:gzdjt2bb6zkdknijroh6tm6i/post/3mgfkj5yzv22m,General Conflict,Neutral,khz new frequency radio garda khz audio bandwidth like likely via kuwait use strongly dry arm super darn unrelated
2026-03-06T14:45:15.281Z,vietnaminsider,#Beijing seeks safe passage for energy shipments as global oil supply faces major disruption#OilMarket #IranWar #China #MarketInsiderhttps://marketinsider.net/china-negotiates-with-iran-to-reopen-hormuz-oil-route/,https://mastodon.social/@vietnaminsider/116182765749244167,General Conflict,Neutral,seek safe passage energy shipment global oil supply face major disruption
2026-03-06T14:40:31.005Z,Newson1,"When bombs fall on cities, the victims are not politicians or generals. They are families, children, doctors, teachers, and workers trying to live their lives.Reports from the Iran conflict suggest that even medical facilities and civilian areas have been affected by the strikes. �The GuardianMany people across the world are questioning whether wars driven by political interests can ever truly be justified when the humanitarian cost is so high.#IranWar #IranIsraelWar #HumanRights #StopWar",https://mastodon.social/@Newson1/116182747118923885,General Conflict,Neutral,bomb fall city victim politician general family child doctor teacher worker try live live report iran conflict suggest even medical facility civilian area affect strike guardian people across world question whether war driven political interest ever truly justified humanitarian cost high
2026-03-06T14:29:16.000Z,metro.co.uk,Donald Trump goes from MAGA to MIGA in post vowing to ‘Make Iran Great Again’  https://fed.brid.gy/r/https://metro.co.uk/2026/03/06/donald-trump-goes-maga-miga-post-vowing-make-iran-great-again-27259189/,https://fed.brid.gy/r/https://metro.co.uk/2026/03/06/donald-trump-goes-maga-miga-post-vowing-make-iran-great-again-27259189/,General Conflict,Neutral,donald trump go manga mega post vow make iran great
2026-03-06T14:36:54.361Z,vietnaminsider,#Oil surges past $90 as #Washington rules out negotiations and Tehran faces leadership vacuum#Iran #Trump #IranWar #MarketInsiderhttps://marketinsider.net/trump-demands-irans-unconditional-surrender-to-end-war/,https://mastodon.social/@vietnaminsider/116182732921731600,General Conflict,Neutral,surge past rule negotiation tehran face leadership vacuum
2026-03-06T14:27:35.685Z,arniedxer.bsky.social,"11630 kHz: a monologue in Arabic, on a rather low modulation, akin to #Iran VOIRI transmissions. Who's that?! 😳  Incidentally, I've found IRIB Arabic's 15135 kHz missing. Have they moved here?  #shortwave #IranWar #WARINIRAN",https://fed.brid.gy/r/https://bsky.app/profile/did:plc:gzdjt2bb6zkdknijroh6tm6i/post/3mgfjhfpxwc2x,General Conflict,Neutral,khz monologue arabic rather low modulation akin voice transmission flush face incidentally live find iris arabic khz miss move
2026-03-06T14:25:36.000Z,ai6yr,"ABC7: US sinking of Iranian ship raises questions of legality""...The sinking of an Iranian warship Tuesday by a U.S. submarine thousands of miles from the war zone in international waters raises questions about whether the attack was legal under the rules of war....""https://abc7.com/post/us-sinking-iranian-ship-raises-questions-legality/18683962/#IranWar #law",https://m.ai6yr.org/@ai6yr/116182688474313184,Military Action,Neutral,acc u sink iranian ship raise question legality sink iranian warship tuesday u submarine thousand mile war zone international water raise question whether attack legal rule war
2026-03-06T14:22:39.000Z,KimPerales,"""Qatar🚨expects all Gulf energy producers to shut ​down exports within weeks &amp; drive ‌oil to $150 a barrel"" -QA Energy Min Saad al-Kaabi.""Everybody🚨that hasn't called for force majeure we expect ⁠will do so in the next ​few days that this continues. All exporters in ​the Gulf region will have to call force majeure.""-A Bakr""If Gulf exporters start declaring force majeure🚨-becomes a physical SUPPLY CRISIS... Global comm stocks cover only ~3 weeks➡️$150 Brent.""-Q Al-Ali#IranWar #Economy #USPol",https://toad.social/@KimPerales/116182676888002464,General Conflict,Neutral,qatar police car light expect gulf energy producer shut export within week amp drive oil barrel energy min say alkaabieverybodypolice car light hast call force maj eure expect next day continue exporter gulf region call force make urea barrie gulf exporter start declare force make police car light become physical supply crisis global comm stock cover week right arrow brent alkali
2026-03-06T14:16:10.000Z,jawarajabbi,@AkaSci Remember: Teump's an idiot and a mad man. He thinks this will happen. It will not. The Iranians are creating the conditions for the ultimate TACO (Trump Always Chickens Out).#IranWar,https://mastodon.online/@jawarajabbi/116182651385786123,General Conflict,Pro-Iran,remember temp idiot mad man think happen iranian create condition ultimate taco trump always chicken
2026-03-06T14:15:43.000Z,downey,"🇺🇳 🚨 BREAKING: UNHCR declares Middle East crisis a ‘major humanitarian emergency’➡️ UNHCR Director for Emergencies Ayaki Ito said the conflict is triggering significant population movements across the region and into Southwest Asia. Nearly 25 million people in the affected areas are already refugees, internally displaced or recent returnees, placing additional strain on fragile host countries.https://www.unhcr.org/news/briefing-notes/unhcr-mobilizing-across-region-middle-east-crisis-escalates#Iran #IranWar #MiddleEast #UN #UNHCR #UnitedNations #StandWithRefugees",https://floss.social/@downey/116182649641338606,General Conflict,Neutral,united nation police car light break declares middle east crisis major humanitarian emergency right arrow director emergency atari ito say conflict trigger significant population movement across region southwest asia nearly million people affected area already refugees internally displaced recent returnees place additional strain fragile host country
2026-03-06T14:15:37.000Z,simon_brooke,"""Then, when [#Trump] begins an illegal war with the help of the oligarch’s AI, the oligarch’s newspaper is full of praise for the AI and the military that uses it.""Indeed.#IranWarAI and the illegal warhttps://buttondown.com/creativegood/archive/ai-and-the-illegal-war/",https://mastodon.scot/@simon_brooke/116182649240390219,General Conflict,Neutral,begin illegal war help oligarchs oligarchs newspaper full praise military us indeed illegal war
2026-03-06T14:10:50.516Z,DrALJONES,"&quot;Shock &amp; Awe didn’t Work in Iraq, either”&quot;The political elite in Washington has hated the Iranian government for 47 years. It has been a thorn in the side of US interests in the region.&quot;&quot;The US petroleum companies... bear as much blame... because they want to get into Iran &amp; develop its petroleum, &amp; they can’t do it as long as that government is there.&quot;https://www.juancole.com/2026/03/shock-either-bradblog.html #USPol #EUPol #IranWar #BigOil #USIsraeliCrimes #USImperialism .",https://mastodon.social/@DrALJONES/116182630433214888,General Conflict,Pro-Iran,shock amp awe didst work iraq either political elite washington hat iranian government year thorn side u interest region u petroleum company bear much blame want get iran amp develop petroleum amp cant long government
2026-03-06T14:10:11.560Z,DrALJONES,"Analysis: &quot;Iran’s measure of success would not be battlefield conquest but turning the war into a chronic dilemma for Washington&quot;.&quot;Iran needs only to raise the costs, prolong the timeline, &amp; widen the theater of confrontation.&quot;A multi-front crisis that is increasingly difficult to control is what &quot;the US experienced in Iraq &amp; Afghanistan: military superiority without political victory.&quot;https://www.juancole.com/2026/03/endless-betrays-central.html #USPol #EUPol #IranWar #USIsraeliCrimes #USImperialism .",https://mastodon.social/@DrALJONES/116182627880523047,General Conflict,Neutral,analysis iran measure success would battlefield conquest turn war chronic dilemma washingtonian need raise cost prolong timeline amp widen theatre confrontation multi front crisis increasingly difficult control u experience iraq amp afghanistan military superiority without political victory
2026-03-06T14:09:33.249Z,DrALJONES,"Interview: &quot;Trump Has No Clear Plan on Iran&quot;: fmr US officials&quot;Before my resignation, [this]is exactly what I was warning against&quot;.~Hala Rharrit&quot;It is ludicrous to expect the American people to believe that Iran would have attacked the US preemptively in the middle of negotiations.&quot;And the contradictory messages from Trump et al. show “how little they were really thinking this through before they went to war.”~Jasmine El-Gamalhttps://www.democracynow.org/2026/3/5/iran_state_defense #USPol #EUPol #IranWar .",https://mastodon.social/@DrALJONES/116182625369737993,Military Action,Neutral,interview trump clear plan iran u official resignation exactly warn ala charr tit ludicrous expect american people believe iran would attack u preemptively middle negotiation contradictory message trumpet al show little really think go war jasmine elgar al
2026-03-06T14:08:45.000Z,KimPerales,"“Zelensky highlighting the moral &amp; strategic poverty🚨of the USA under Trump. In the last year Trump has ended all military aid for #Ukraine, has undermined Ukrainian air defense, has tried to bully Ukraine in handing over territory, &amp;🚨has rolled out the red carpet for #Putin. And now the USA is desperate for Ukrainian help because the Trump admin🚨is incompetent in defense matters &amp; UA knows what it’s doing.Any chance Trump has the decency to say thanks?”-P O’Brien#IranWar #Drones #USPol",https://toad.social/@KimPerales/116182622260024062,Military Action,Neutral,kerensky highlight moral amp strategic poverty police car light u trump last year trump end military aid undermine ukrainian air defense try bully ukraine hand territory police car light roll red carpet u desperate ukrainian help trump admin police car light incompetent defense matter amp know chance trump decency say thanks brief
2026-03-06T13:58:59.421Z,voyager21stC,#Iranwar report and insights https://docs.google.com/document/d/1_bB_zXnQcHfEHLMfre_BFFe18KC5I7PG/edit?usp=drivesdk&amp;ouid=102650115553824204817&amp;rtpof=true&amp;sd=true,https://mastodon.social/@voyager21stC/116182583831364255,General Conflict,Neutral,report insight
2026-03-06T13:56:40.835Z,atpgeo.com,"🔴 LIVE STREAM: Ukraine, Iran, &amp; a Fracturing World - Who Will Rise? 🔴 LIVE STREAM: Geopolitics News 📅 2026-03-06 14:10 UTC (Starts in 13m) https://www.youtube.com/watch?v=BXFgaoGQwKU  #Geopolitics #IranWar #EnergyCrisis #Geopolitics #UkraineConflict #GlobalNews #livestream",https://fed.brid.gy/r/https://bsky.app/profile/did:plc:k245sxjrjanxprhcm6mu36oj/post/3mgfhq55h3u2q,General Conflict,Neutral,red circle live stream ukraine iran amp fracture world rise red circle live stream geopolitics news calendar etc start
2026-03-06T13:56:35.000Z,SueInRockville,"Why I keep saying""Trump, Vance, Rubio &amp; Hegseth do not give a shit about how many soldiers die for their incompetence &amp; stupidity?Look no further ⬇️Those who made the ultimate sacrifice return home &amp;not 1 from #TrumpRegime or #GOPTraitors are therehttps://www.instagram.com/reel/DVg0vuMFKCO/?igsh=MW5taDVrbW55aGFuNw==#IranWar",https://mstdn.social/@SueInRockville/116182574413986654,General Conflict,Neutral,keep say trump vance rubin amp seth give shit many soldier die incompetence amp stupidity look arrow make ultimate sacrifice return home
2026-03-06T13:53:08.556Z,Lazarou,RE: https://union.place/@workersliberty/116182124382609178A fanatical religious regime threatening the World.....the USA.#IranWar #USPOL #USPolitics #Theocracy #Evangelicals #GOP,https://mastodon.social/@Lazarou/116182560836471494,General Conflict,Anti-Iran,fanatical religious regime threaten world u
2026-03-06T13:52:27.000Z,Geri,"The USA has already gone through more patriot missiles in 7 days of attacking Iran than it has made available in its 4 years of supply to Ukraine fighting Russia I think that says all you need to know#iranwar#Ukraine #feedtheenemyhttps://cepa.org/article/the-iran-war-peril-and-opportunity-for-ukraine/?hl=en-GBhttps://militarywatchmagazine.com/article/us-patriot-interceptors-five-days-iran#:~:text=Reports%20from%20multiple%20Western%20sources,attack%20against%20the%20country%20on",https://mastodon.online/@Geri/116182558120904187,Military Action,Anti-Iran,u already go patriot missile day attack iran make available year supply ukraine fight russia think say need know
2026-03-06T13:52:22.000Z,Akshay,"Power prices in Europe swing wildly between free sunlight and expensive gas:""On March 4, day-ahead prices in Denmark swung from €26 per MWh at 2pm to almost €430 at 5.45pm, less than four hours later. Prices in the Netherlands jumped from €24 to €450 over the same period, with similarly large swings in Belgium and Germany.""--&gt; We need way more grid storagehttps://www.ft.com/content/ac77915d-7542-4129-aabe-d3a9daff2573#Climate #Energy #Grids #Electricity #IranWar #EU #EUPol #Renewables #FossilFuels",https://eupolicy.social/@Akshay/116182557836699308,General Conflict,Neutral,power price europe swing wildly free sunlight expensive jason march day head price denmark swung per mph pm almost pm less four hour later price netherlands jump period similarly large swing belgium germany need way grid storage
2026-03-06T13:52:16.839Z,ChrisHolladay,Woke up this amStill have a war Still have crazy people in White House provokingescalation to even higher levels.Still no Congress with the balls to stop said crazy person.No SCOTUS to limit his insanity.A hearty &quot;fuck off bitch&quot; to those that decided not voting was in their best interest.You know who you are.#iran#IranWar #trump#congress#scotus,https://mastodon.social/@ChrisHolladay/116182557447451434,General Conflict,Anti-Iran,woke still war still crazy people white house provoke escalation even high level still congress ball stop say crazy person scotus limit insanity hearty fuck bitch decide voting best interest know
2026-03-06T13:48:53.000Z,KimPerales,"#Russia is providing #Iran with targeting information to attack American forces in the Middle East, the 1st indication that another major US adversary is participating -even indirectly -in the war.Trump's allies: North Korea, Argentina...Putin has betrayed him again. The gulf states are livid. Macron is aiding LB, Spain is refusing...Americans must rise up &amp; work to remove this regime before the global #economy sinks into a deep #recession.#IranWar #Protest #USPolhttps://www.washingtonpost.com/national-security/2026/03/06/russia-iran-intelligence-us-targets/",https://toad.social/@KimPerales/116182544143848481,Protest/Activism,Anti-Iran,provide target information attack american force middle east st indication another major u adversary participate even indirectly war trumps ally north korea argentina putin betray gulf state livid macron aid la spain refuse american must rise amp work remove regime global sink deep
2026-03-06T13:42:02.600Z,HappytoBe,One of the key components of Kushner&#39;s deals in the middle east is the United Arab Emirates. They have published their disdain for the U.S. strike on Iran and slapped Trump down for his failure to understand the impact on stability in the region. I have long said Kushner does not fully understand the vipers he is dealing with. He is nothing but a gnat and a tool for them. That reality may soon come to strike him. #uspolitics #MiddleEastConflict #kushner #IranWar,https://mastodon.social/@HappytoBe/116182517192041599,General Conflict,Neutral,one key component usher deal middle east united arab emirate publish disdain u strike iran slap trump failure understand impact stability region long say usher fully understand viper deal nothing gnat tool reality may soon come strike
2026-03-06T13:38:00.000Z,joenepraat,"RE: https://mas.to/@aljazeera_gotgrip/116181408383512776And who needs to pay that? Right! You, me, the poor, the marginalised, our children, etc. When are we going to wake-up!? Or more, don't fall at sleep, don't get numb, don't let yourself overwhelm with shock and awe!Time for some Rage Against The Machine to wake you up (or keep you awake):https://www.youtube.com/watch?v=ZaTCl0fqIX0#IranWar #LebanonWar #War #MiddleEast #Trump #Israel #StopTheWar",https://todon.nl/@joenepraat/116182501349607108,General Conflict,Neutral,need pay right poor marginalise child etc go makeup do fall sleep do get numb do let overwhelm shock awe time rage machine wake keep awake
2026-03-06T13:29:22.000Z,ScottLucas,"RE: https://journa.host/@ScottLucas/116181133954451208Prime Minister Nawaf Salam: #Lebanon “dragged further into the abyss” in a conflict it “did not seek and did not choose”Amid #Israel 's ""massive"" forced displacement from southern Lebanon and south #Beirut""Situation is grave, and our responsibility is high""#IranWar #Hezbollah",https://journa.host/@ScottLucas/116182467377585551,General Conflict,Neutral,minister nawab salem drag abyss conflict seek choose mid massive force displacement southern lebanon south situation grave responsibility high
2026-03-06T13:20:19.000Z,newsbeep,"The Day Israel Lost AmericaPhoto: Daniel Torok/White House/Handout Years from now, February 28, 2026, might be remembered as the day Israel finally…#NewsBeep #News #BreakingNews #americanaffairs #breakingnews #DonaldTrump #iranwar #Israelhttps://www.newsbeep.com/421013/",https://newsbeep.org/@newsbeep/116182431789511645,General Conflict,Neutral,day israel lose america photo daniel white house handout year february might remember day israel finally
2026-03-06T13:08:09.508Z,RonSupportsYou,"The #IranWar: it&#39;s not just the military personnel&#39;s lives lost and the costs, it&#39;s the terror: &quot;When Time asked Pres. Donald Trump whether citizens should be worried about retaliatory attacks on American soil following his Iran strikes, he all but shrugged. &#39;I guess,&#39; he replied&quot;: https://www.huffpost.com/entry/latest-news-live-updates_n_69a562ade4b0d383f503f9f5/liveblog_69aa2b91e4b0803f139f719a?origin=home-whats-happening-unit",https://mastodon.social/@RonSupportsYou/116182383952003726,Military Action,Anti-Iran,military personnel live lose cost terror time ask pres donald trump whether citizen worried retaliatory attack american soil follow iran strike shrug guess reply
2026-03-06T13:07:00.000Z,yogthos,"Vessel traffic through the Strait of Hormuz has dropped from an average of 138 ships a day to just two in the 24 hours to Thursday, the Joint Maritime Information Center has reported.https://oilprice.com/Latest-Energy-News/World-News/Daily-Ship-Traffic-in-Strait-of-Hormuz-Plummets-From-138-to-Just-2.html#news #iran #iranwar",https://social.marxist.network/@yogthos/116182379413722621,General Conflict,Neutral,vessel traffic strait hormuz drop average ship day two hour thursday joint maritime information center report
2026-03-06T12:53:25.292Z,idkfq,"I do not know if that is the right lucifer, but in any case, i believe he is right#lucifer #iranWar #usa2026 #uspolicy",https://mastodon.social/@idkfq/116182326003882419,General Conflict,Neutral,know right lucifer case believe right
2026-03-06T12:52:50.000Z,PoliticalCartoon,Graeme Bandeira @GraemeBandeira on #Trump #FifaPeacePrize #Iran #IranWar #middeeastwar – political cartoon gallery in London original-political-cartoon.com,https://mastodonapp.uk/@PoliticalCartoon/116182323736105657,General Conflict,Neutral,gramme band ira political cartoon gallery london originalpoliticalcartooncom
2026-03-06T12:44:59.000Z,yogthos,"Russia is providing Iran intelligence to target U.S. forces, officials say. 🎻 https://www.washingtonpost.com/national-security/2026/03/06/russia-iran-intelligence-us-targets#news #iran #iranwar",https://social.marxist.network/@yogthos/116182292866188584,General Conflict,Anti-Iran,russia provide iran intelligence target u force official say violin
2026-03-06T11:31:19.000Z,metro.co.uk,Brits arriving home say Dubai ‘is like the band still playing on Titanic as it sank’  https://fed.brid.gy/r/https://metro.co.uk/2026/03/06/brits-arriving-home-say-dubai-is-like-band-still-playing-titanic-sank-27257291/,https://fed.brid.gy/r/https://metro.co.uk/2026/03/06/brits-arriving-home-say-dubai-is-like-band-still-playing-titanic-sank-27257291/,General Conflict,Neutral,brit arrive home say dubai like band still play titanic sank
2026-03-06T12:33:19.927Z,DrALJONES,"Report: US investigators say the US military probably carried out the double-tap strike that killed 165, mostly young girls, at an Iranian elementary school.A &quot;double-tap strike&quot; kills one group, then waits for medics &amp; other civilians to arrive in order to kill them as well.https://www.middleeasteye.net/news/us-investigators-say-american-strike-most-likely-responsible-iranian-school-massacre #USWarCrimes #USPol #EUPol #IranWar #IranSchoolAttack #news .",https://mastodon.social/@DrALJONES/116182247009412220,Military Action,Pro-Iran,report u investigator say u military probably carry double tap strike kill mostly young girl iranian elementary school double tap strike kill one group wait medic amp civilian arrive order kill well
2026-03-06T12:32:22.000Z,junesim63,"""Washington’s western allies may be privately uncomfortable at being visibly associated with another illegal US-Israeli war. But in supporting more than two years of genocide in Gaza, they already made their pact with the devil. There is no going back now""#Iran #Israel #US #IranWarIsrael planned this war on Iran for 40 years. Everything else is a smoke screen | Middle East Eyehttps://www.middleeasteye.net/opinion/israel-planned-war-iran-40-years-everything-else-smoke-screen",https://mstdn.social/@junesim63/116182243260850180,General Conflict,Pro-Iran,washington western ally may privately uncomfortable visibly associate another illegal u israeli war support two year genocide gaza already make pact devil go back plan war iran year everything else smoke screen middle east eye
2026-03-06T12:21:03.000Z,zombywoof,I have a question for the American #republican #Congress :Are you proud of yourselves?#ICE #Epstein #Democracy #tariffs #Racist #incompetence #IRAN #iranwar,https://mastodon.org.uk/@zombywoof/116182198747956462,General Conflict,Neutral,question american proud
