created_at,username,sentiment_text,url,subject_tag,stance_category,final_text
2026-03-07T13:18:03.000Z,PoliticalCartoon,Brighty @Brighti on #Trump #MarcoRubio #KeirStarmer #IranWar @TheSun – political cartoon gallery in London original-political-cartoon.com,https://mastodonapp.uk/@PoliticalCartoon/116188085191798001,General Conflict,Neutral,bright political cartoon gallery london originalpoliticalcartooncom
2026-03-07T13:15:37.000Z,yogthos,Donald Trump’s decision not to refill the Strategic Petroleum Reserve drained by his predecessor Joe Biden has left consumers exposed to an oil price shock following US and Israeli attacks on Iran. 😆https://www.ft.com/content/d546fd5b-4a0c-4b90-8bee-9e85b75458ed#usa #iran #iranwar #news,https://social.marxist.network/@yogthos/116188075627462165,Military Action,Neutral,donald trump decision refill strategic petroleum reserve drain predecessor joe biden leave consumer expose oil price shock follow u israeli attack iran grin squint face
2026-03-07T13:13:50.000Z,G3rt,#iranwar #IsraelTerroristState #antiZionist,https://mastodon.uno/@G3rt/116188068632461535,General Conflict,Pro-Iran,
2026-03-07T13:12:10.438Z,RonSupportsYou,"You, @habitsofwaste.bsky.social, wrote: &quot;The president himself said we are at war.&quot;Yes, but in Donald Trump&#39;s defense, he is known to lie very often. Not this time, but very often. #IranWar",https://mastodon.social/@RonSupportsYou/116188062051773130,General Conflict,Neutral,ask social write president say ware donald trumps defense know lie often time often
2026-03-07T13:12:00.000Z,zombywoof,What was that you said????...Oh...You must listen to #newsnation#maga #mawa #ICE #Epstein #Democracy #tariffs #Racist #incompetence #IRAN #iranwar,https://mastodon.org.uk/@zombywoof/116188061375905709,General Conflict,Neutral,say must listen
2026-03-07T13:08:15.782Z,RonSupportsYou,"Nicholas Kristof wrote about the #IranWar: &quot;Pres. Trump and Prime Minister Benjamin Netanyahu of Israel, the architects of this war, both seem afflicted by the arrogance of power&quot;: https://www.nytimes.com/2026/03/07/opinion/iran-war-trump.html &quot;A president’s first task is to make us safer. Instead, it seems to me that Trump has catapulted us into an unnecessary conflict, consuming American and Iranian lives alike, costing billions of dollars and damaging the economy — all while propelling us into peril.&quot; #politics #UnnecessaryWar",https://mastodon.social/@RonSupportsYou/116188046673652572,General Conflict,Neutral,nicholas kris write pres trump prime minister benjamin tanya israel architect war seem afflict arrogance power president first task make u safe instead seem trump catapult u unnecessary conflict consume american iranian life alike cost billion dollar damage economy propel u peril
2026-03-07T13:03:24.618Z,TheDailyPerspective,Data Centres Become Targets as Digital Infrastructure Enters Middle East Conflict#AWS #DataCentres #MiddleEast #IranWar #AusNewshttps://thedailyperspective.org/article/2026-03-07-data-centres-become-targets-as-digital-infrastructure-enters-middle-east-conflic-e4704193,https://mastodon.social/@TheDailyPerspective/116188027591416549,General Conflict,Neutral,data centre become target digital infrastructure enters middle east conflict
2026-03-07T13:02:42.395Z,rvps2001,"🇺🇦 Ukrainian manufacturers of cheap interceptor drones designed to knock out enemy unmanned aerial vehicles say they have the capacity to export in large volumes, amid enquiries from the United ​States and Middle East prompted by the #Iran war.https://www.reuters.com/business/aerospace-defense/ukraines-interceptor-drone-makers-look-exports-gulf-iran-war-flares-2026-03-07/#ukraine #iranWar",https://mastodon.social/@rvps2001/116188024824622765,Military Action,Neutral,ukraine ukrainian manufacturer cheap interceptor drone design knock enemy unmanned aerial vehicle say capacity export large volume amid enquiry united state middle east prompted war
2026-03-07T13:00:14.275Z,publicnewsfeed,Israel fires &#39;broad-scale&#39; strikes on Tehran as war hits second weekIsrael announced a new wave of &quot;broad-scale&quot; strikes on Tehran on Saturday as the escalating war in the Middle East entered its second week and oil prices surged on fears about global supply disruption.https://www.rfi.fr/en/international/20260307-israel-fires-broad-scale-strikes-on-tehran-as-war-hits-2nd-week#IsraelNews #News #Tehran #IranNews #IranWar #Israel #Iran,https://mastodon.social/@publicnewsfeed/116188015117314179,General Conflict,Neutral,israel fire broad scale strike tehran war hit second week israel announce new wave broad scale strike tehran saturday escalate war middle east enter second week oil price surge fear global supply disruption
2026-03-07T12:58:54.050Z,DrALJONES,"Interview: &quot;Iran’s military prowess &amp; America’s &amp; Israel’s impulsive imperial hubris, are on display.&quot;Detailed analysis of:* Why the US went to war;* Iran&#39;s miltary strategy;* US &amp; Israeli goals &amp; flawed assumptions* effect of the war on global resource flow&quot;A huge amount of global oil &amp; gas passes through the Strait of Hormuz, particularly for Europe. It&#39;s already starting to affect the oil price.&quot;~Alastair Crookehttps://www.youtube.com/watch?v=YL8rXeNkXsQ #USPol #eupol #IranWar #USImperialism .",https://mastodon.social/@DrALJONES/116188009858370805,General Conflict,Pro-Iran,interview iran military prowess amp america amp israel impulsive imperial hubris display detail analysis u go war iran military strategy u amp israeli goal amp flaw assumption effect war global resource flow huge amount global oil amp gas pass strait hormuz particularly europe already start affect oil price alistair brooke
2026-03-07T12:54:14.000Z,BrianJopek,"I do hope Kevin is being sarcastic. Otherwise, he’s simply another MAGA dipshit. #IranWar",https://mastodon.world/@BrianJopek/116187991557396929,General Conflict,Neutral,hope kevin sarcastic otherwise hes simply another manga dip shit
2026-03-07T12:49:07.000Z,ScottLucas,"RE: https://journa.host/@ScottLucas/116186718091385958#Israel Defense Forces repeat warning to all civilians in southern #Lebanon to evacuateIDF, which has also demanded the evacuation of southern suburbs of #Beirut, estimates that 420,000+ Lebanese civilians have fled their homes#IranWar",https://journa.host/@ScottLucas/116187971397226742,General Conflict,Neutral,defense force repeat warn civilian southern evacuate also demand evacuation southern suburb estimate lebanese civilian flee home
2026-03-07T12:47:38.000Z,BrianJopek,This is going to be awkward. I#USpol #IranWar “Can't wait for the latest update on the new ballroom. Hope we hear about the drape selection.” - Jim Wright,https://mastodon.world/@BrianJopek/116187965576143074,General Conflict,Neutral,go awkward cant wait late update new ballroom hope hear drape selection jim wright
2026-03-07T12:40:14.000Z,newsbeep,The Latest: Israel hammers Beirut and Tehran as Iran fires missiles at Israel and the GulfIran’s president rejected a demand by the United States for an unconditional surrender on Saturday and apologized for…#NewsBeep #News #BreakingNews #130850695 #Article #breakingnews #Generalnews #iranwar #Israel #Warandunrest #Worldnewshttps://www.newsbeep.com/422728/,https://newsbeep.org/@newsbeep/116187936520805718,Military Action,Neutral,late israel hammer beirut tehran iran fire missiles israel gulf rank president reject demand united state unconditional surrender saturday apologize
2026-03-07T12:30:47.000Z,ScottLucas,"RE: https://journa.host/@ScottLucas/116186718091385958#Israel Defense Forces: Our special forces carried out raid in southern #Lebanon to locate remains of Lt. Col. Ron Arad, whose plane went down during bombing mission in 1986Witnesses say 26 Lebanese killed when Israelis l anded 4 helicopters in town of Nabi Chit in eastern Bekaa valley#IranWar",https://journa.host/@ScottLucas/116187899328399753,General Conflict,Neutral,defense force special force carry raid southern locate remain col ron arad whose plane go bomb mission witness say lebanese kill israeli land helicopter town nazi chit eastern begin valley
2026-03-07T12:29:30.000Z,yogthos,"A US-sanctioned tanker blacklisted for handling Iranian liquefied petroleum gas crossed the Strait of Hormuz on Friday, one of only a handful of vessels to make it through the waterway in recent days.https://finance.yahoo.com/news/us-sanctioned-gas-tanker-sails-102954007.html#iran #iranwar #news #hormuz",https://social.marxist.network/@yogthos/116187894303898413,General Conflict,Neutral,unsanctioned tanker blacklist handle iranian liquefy petroleum gas cross strait hormuz friday one handful vessel make waterway recent day
2026-03-07T12:24:47.000Z,ScottLucas,"RE: https://journa.host/@ScottLucas/116186718091385958Energy Minister of #Qatar, which is seeking an end to #IranWar: Conflict could “bring down economies of world” with Gulf energy exporters shutting down production and the price of oil rising to $150 a barrelEven if war ends, will take Qatar “weeks to months” to return to normal cycle of deliveries",https://journa.host/@ScottLucas/116187875760846526,General Conflict,Neutral,minister seek end conflict could bring economy world gulf energy exporter shut production price oil rise barrel even war end take qatar week month return normal cycle delivery
2026-03-07T12:24:51.122Z,MarketForcesA,"The Iran conflict could pose additional challenges for some emerging-market sovereigns through channels such as energy imports, remittances, fiscal subsidies, exchange rates, and access to international finance...https://dmarketforces.com/iran-conflict-raises-new-credit-risks-for-emerging-market-sovereigns/#IranWar #EmergingMarket",https://mastodon.social/@MarketForcesA/116187875973888673,General Conflict,Neutral,iran conflict could pose additional challenge emerge market sovereign channel energy import remittance fiscal subsidy exchange rate access international finance
2026-03-07T11:56:11.039Z,hbrpgm,The Illusion of Maritime Transparency  https://peer.adalta.social/w/kmZCpNjCD14MuavyshpqR3,https://peer.adalta.social/w/kmZCpNjCD14MuavyshpqR3,General Conflict,Neutral,illusion maritime transparency
2026-03-07T11:51:28.000Z,Casey,US automakers can still change their minds about EVs...https://cleantechnica.com/2026/03/06/us-battery-makers-gave-up-waaaaay-too-soon-on-ev-sales-but-they-have-a-backup-plan/#evs #electricvehicles #iranwar #iran #war #gasoline #fuel #energy #gasprice #priceofgas #painatthepump #ford #gm #federalreserve #banks #banking #us #energypolicy #evsales #usedevs #sustainable #sustainability,https://newsie.social/@Casey/116187744730635793,General Conflict,Neutral,u automaker still change mind eve
2026-03-07T11:51:16.000Z,Casey,US automakers can still change their minds about EVs...https://cleantechnica.com/2026/03/06/us-battery-makers-gave-up-waaaaay-too-soon-on-ev-sales-but-they-have-a-backup-plan/#evs #electricvehicles #iranwar #iran #war #gasoline #fuel #energy #gasprice #priceofgas #painatthepump #ford #gm #federalreserve #banks #banking #us #energypolicy #evsales #usedevs #sustainable #sustainability,https://mastodon.green/@Casey/116187743929096966,General Conflict,Neutral,u automaker still change mind eve
2026-03-07T11:38:16.000Z,ai6yr,The data never lies!(Narrator: the data lies)https://www.marinetraffic.com/en/ais/home/centerx:53.812/centery:24.694/zoom:16#ais #spoofing #jamming #IranWar,https://m.ai6yr.org/@ai6yr/116187692825711356,General Conflict,Anti-Iran,data never lie narrator data lie
2026-03-07T11:22:05.000Z,ai6yr,"Hmm, I hope this flight path was a spoof, not the real thing. (UAE5V, if it was a real flight, at -250ft barometric altitude before signal loss at the edge of Iran airspace). I guess I'll go look up the overnight news. (Looks like missing data and this plane landed at DXB, after some crazy crazy descent pattern)https://globe.adsb.fi/?icao=8960f7,8964b1#UAE5V #aviation  #IranWar",https://m.ai6yr.org/@ai6yr/116187629166301622,General Conflict,Neutral,hmm hope flight path spoof real thing real flight barometric altitude signal loss edge iran airspace guess ill go look overnight news look like miss data plane land dub crazy crazy descent pattern
2026-03-07T11:20:31.173Z,knowprose,Must be Saturday. Such cheerful news.https://nymag.com/intelligencer/article/the-future-of-war-is-drones-bombing-data-centers.html#iranwar #ai #datacenter  #claude #aws,https://mastodon.social/@knowprose/116187623007050659,Military Action,Neutral,must saturday cheerful news
2026-03-07T11:17:36.776Z,arniedxer.bsky.social,"At 1110z Sat Mar 7, weird... I can't find ANY Iranian Bubble Jammers on #shortwave 😮  15750.3 17900 Iran International and 17840 Radio Farda are all unjammed!  9365 Farda is barely audible but I don't see any more carriers there either  No sig on 5860 in daytime  Game over? #Iran #IranWar #WARINIRAN",https://fed.brid.gy/r/https://bsky.app/profile/did:plc:gzdjt2bb6zkdknijroh6tm6i/post/3mghpcmdlus2t,General Conflict,Neutral,sat mar weird cant find iranian bubble hammer face open mouth iran international radio garda unnamed garda barely audible do see carrier either sig daytime game
2026-03-07T11:00:18.935Z,publicnewsfeed,"Iran&#39;s president apologizes to neighbors, defies US demandsIran&#39;s president apologized for attacks on regional countries but kept up criticism of America. His comments come as Iranian missiles and drones continue to fly toward Israel and Gulf Arab states. DW has the latest.https://www.dw.com/en/iran-s-president-apologizes-to-neighbors-defies-us-demands/live-76256213?maca=en-rss-en-all-1573-rdf#Khomeini #IranWar #News #IranNews #Iran #USANews #USA",https://mastodon.social/@publicnewsfeed/116187543562677111,Military Action,Neutral,iran president apologize neighbour defy u demand rank president apologize attack regional country keep criticism america comment come iranian missile drone continue fly toward israel gulf arab state late
2026-03-07T10:54:44.995Z,DrALJONES,"Interview: &quot;America’s War for Greater Israel&quot;Mouin Rabbani unpacks:* the explosive new documents exposing Israel’s systematic ethnic cleansing in 1948;* Trump&#39;s torpedoing of diplomacy at the very moment negotiations were gaining traction;* whether Tehran’s bombing of Gulf states is a strategic miscalculation;* how Israel&#39;s unending quest for security has fuelled decades of expansion, war &amp; regional upheaval.https://www.middleeastmonitor.com/20260303-americas-war-for-greater-israel-palestine-this-week-with-mouin-rabbani/ #USPol #EUPol #IranWar #USIMperialism .",https://mastodon.social/@DrALJONES/116187521676480869,General Conflict,Pro-Iran,interview americas war great israel ruin rabbi unpacks explosive new document expose israel systematic ethnic cleanse trump top diplomacy moment negotiation gain traction whether tehran bomb gulf state strategic miscalculation israel unending quest security fuel decade expansion war amp regional upheaval
2026-03-07T10:51:08.000Z,ScottLucas,"RE: https://journa.host/@ScottLucas/11618749366824414230-min analysis#Ukraine gains in #Zaporizhzhia after #Russia loses #StarlinkPositive changes in #Zelensky Govt, e.g. #Fedorov and #Budanov, to deal w invasion and w corruptionEffect on #UkraineWar of US- #Israel war on #Iran#IranWar",https://journa.host/@ScottLucas/116187507512560628,General Conflict,Neutral,analysis gain lose change govt leg deal invasion corruption effect u war
2026-03-07T10:44:20.000Z,Rania,"I'm Rania from Gaza 🇵🇸A mother of four children. My husband and daughter are injured, and we have no income.We are living in very hard conditions, and this link is our only hope.Please donate or share. Your kindness can help us survive. 🙏💔https://gofund.me/d0cc0587#Gaza #palestine #genocide #Israel #freepalestine #save_gaza_children #SupportGaza #Humanity #Muslim #Ramadan #StopTheGenocide #fediAid #iran #Gaza #Israel #IranWar #Iran",https://freesewing.social/@Rania/116187480759364484,General Conflict,Neutral,mania gaza palestinian territory mother four child husband daughter injured income live hard condition link hope please donate share kindness help u survive folded hand broken heart
2026-03-07T09:09:04.000Z,metro.co.uk,Donald Trump hammers Iran with ‘biggest’ bombing yet demanding ‘unconditional surrender’  https://fed.brid.gy/r/https://metro.co.uk/2026/03/07/donald-trump-hammers-iran-biggest-bombing-yet-demanding-unconditional-surrender-27277608/,https://fed.brid.gy/r/https://metro.co.uk/2026/03/07/donald-trump-hammers-iran-biggest-bombing-yet-demanding-unconditional-surrender-27277608/,General Conflict,Neutral,donald trump hammer iran big bomb yet demand unconditional surrender
2026-03-07T10:31:18.498Z,publicnewsfeed,Iran vows no surrender as strikes hit Tehran airportFollow live updates as Iran&#39;s President Masoud Pezeshkian said his country will not surrender to Israel and the United States as the war enters its second week.https://www.rte.ie/news/2026/0307/1562112-middle-east-updates/#IranNews #Iran #News #Tehran #IranWar,https://mastodon.social/@publicnewsfeed/116187429502261572,General Conflict,Neutral,iran vow surrender strike hit tehran airport follow live update iran president ma oud pee skin say country surrender israel united state war enters second week
2026-03-07T10:29:51.261Z,theurbanherald,"We asked ChatGPT, Gemini and Claude: how likely is global war from the Iran conflict?Full breakdown 👇 https://theurb.co/iran-conflict-escalation#IranConflict #StraitOfHormuz #MiddleEastWar #Geopolitics #WorldNews #BreakingNews #News #War #USA #Israel #Iran #IranWar",https://mastodon.social/@theurbanherald/116187423785319204,General Conflict,Neutral,ask chat gemini claude likely global war iran conflict full breakdown backhand index point
2026-03-07T10:25:55.000Z,ScottLucas,RE: https://journa.host/@ScottLucas/116186718091385958Toll rises to 26+ killed in #Israel airstrikes on Nabi Chit in the Bekaa Valley in eastern #Lebanon#IranWar,https://journa.host/@ScottLucas/116187408303300780,General Conflict,Neutral,rise kill airstrikes nazi chit begin valley eastern
2026-03-07T10:01:12.000Z,kentishfran,Trump wants the Iranians to rise up and take back their country while bombing and killing them.Regime change or extermination?#Trump #iranwar https://www.theguardian.com/world/2026/mar/06/tehran-bombing-iran-night-of-terror?CMP=Share_AndroidApp_Other,https://mastodonapp.uk/@kentishfran/116187311143947719,General Conflict,Anti-Iran,trump want iranian rise take back country bomb kill regime change extermination
2026-03-07T10:00:17.000Z,newsbeep,"US to send anti-drone system to Mideast after successful use in Ukraine, officials sayAn American anti-drone system proven to work against Russian dron…#NewsBeep #News #Headlines #circulated-air-force-times #circulated-army-times #circulated-defense-news #circulated-marine-corps-times #circulated-military-times #circulated-navy-times #counter-drone #dn-dnr #Drones #hegseth #iranwar #Israel #MiddleEast #military-times #Pentagon #Trump #Ukraine #World #zelenskyyhttps://www.newsbeep.com/422568/",https://newsbeep.org/@newsbeep/116187307524538959,Military Action,Neutral,u send anti drone system mideast successful use ukraine official satan american anti drone system proven work russian drop airport time army time defense news marine pastimes military time navy time drone der time
2026-03-07T10:00:17.633Z,publicnewsfeed,"Iran war enters second week, Trump demands ‘unconditional surrender’War in Iran entered its second week amid renewed uncertainty about how or when hostilities will endhttps://www.sabcnews.com/sabcnews/iran-war-enters-second-week-as-trump-demands-unconditional-surrender/#IranNews #Trump #News #Iran #USA #IranWar #USANews",https://mastodon.social/@publicnewsfeed/116187307539471848,General Conflict,Neutral,iran war enters second week trump demand unconditional surrender war iran enter second week amid renewed uncertainty hostility end
2026-03-07T09:43:57.000Z,zombywoof,Color me diagnosed...#TDSTrump dérangement syndrome https://youtube.com/shorts/PxLNDa8AoZ8?si=6Vg-RADCWUlzKkSB#ICE #Epstein #Democracy #tariffs #Racist #incompetence #IRAN #iranwar,https://mastodon.org.uk/@zombywoof/116187243286498546,General Conflict,Neutral,color diagnose derangement syndrome
2026-03-07T09:41:26.000Z,liztai,"I love how posts on Iran on Chinese social media are either straight up facts or posts that remind us of the humanity on the ground. I have not seen any fear mongering or gloating like you see on English social media. There is, to my surprise, Israeli propaganda straight from the Israeli embassy in China. But the people in the comments are literally telling them to scram and bugger off.On the whole it's been easier to get the news and updates about the conflict on  Weibo. (It's feed is clean with a list of updates, and I don't have to wade through racist, bigoted, hate-filled awfulness to get any updates.) Xiaohongshu is not as political, and it's filled with beautiful videos about Chinese people who had visited Iran. All the posts and the comments have a common theme, ""We wish for a peaceful Iran and for no more wars"".Why is English social media so violent, racist and bigoted? I don't know.A part of me believes that it's due to strict moderation on Chinese social media. They are not nirvana, mind you, but people are not allowed to incite violence or hatred there.Also, by nature, I feel that Chinese people prefer harmony over conflict, so they are naturally averse to wars.*Ps I can believe the US bombed a playground. Do they hate children that much?Ps: Post was translated to English by Google Translate.* Just a theory don't @ me!#Iran #iranwar #China #SocialMedia",https://hachyderm.io/@liztai/116187233400091349,Protest/Activism,Pro-Iran,love post iran chinese social medium either straight fact post remind u humanity ground see fear monger gloat like see english social medium surprise israeli propaganda straight israeli embassy china people comment literally tell scram bugger whole easy get news update conflict igbo fee clean list update do wade racist bigoted hat fill awfulness get update xiaoping political fill beautiful video chinese people visit iran post comment common theme wish peaceful iran war english social medium violent racist bigoted do know part believe due strict moderation chinese social medium nirvana mind people allow incite violence hatred also nature feel chinese people prefer harmony conflict naturally averse wasp believe u bomb playground hate child much post translate english google translate theory do
2026-03-07T09:40:10.000Z,i47i,"Trump has privately shown serious interest in U.S. ground troops in Iran&gt; The president’s private comments have not focused on a large-scale ground invasion of Iran, but rather on the idea of a small contingent of U.S. troops that would be used for specific strategic purposes, sources say. https://www.nbcnews.com/politics/white-house/trump-privately-shown-serious-interest-us-ground-troops-iran-rcna262176 #Iran #IranWar #DonaldTrump",https://hachyderm.io/@i47i/116187228412929090,General Conflict,Neutral,trump privately show serious interest u grind troop range president private comment focus large scale ground invasion iran rather idea small contingent u troop would use specific strategic purpose source say
2026-03-07T09:39:13.000Z,Sage7225,The failure of the US in the Iran War has parallels to the failure of the US in the Vietnam War.https://www.theguardian.com/commentisfree/2025/may/01/us-vietnam-war-media#antiwar#iranwar#vietnamwar#freepalestine#freeiran#fuckus#fuckisrael,https://mas.to/@Sage7225/116187224677152342,General Conflict,Pro-Iran,failure u iran war parallel failure u vietnam war
2026-03-07T09:38:45.000Z,MichalKubal,"Michal Kubal 🇨🇿 𝕏🔁 @MahmoudianArman:#Iran’s president #Pezeshkian just issued a video message. These were his main points:1.He rejected unconditional surrender to the United States.2.He apologized to neighboring countries targeted by Iranian attacks.3.He said some attacks were carried out independently by regional commanders after the removal of senior leadership.4.He stated that since yesterday (likely Friday), a temporary leadership council has ordered a halt to attacks on neighboring countries, unless their territory is used to attack Iran.5.He warned regional groups not to play into the hands of #Israel and the United States by attacking Iran, likely referring to Kurdish armed groups. #IranWar",https://zpravobot.news/@MichalKubal/116187222876267074,Military Action,Neutral,michael tubal czechia repeat button president issue video message main point reject unconditional surrender united state apologize neighbour country target iranian attack say attack carry independently regional commander removal senior leadership state since yesterday likely friday temporary leadership council order halt attack neighbour country unless territory use attack iran warn regional group play hand united state attack iran likely refer kurdish arm group
2026-03-07T09:17:35.038Z,TreeStarMan,"@ojala But #Trump says he doesn’t care whether or not #Iran’s leader is democratically elected, in fact he’d be happy with a democratically elected leader. That’s why he wants to select the leader. He’s thought through it all very carefully.🤣🤣🤣 #IranWar",https://mastodon.social/@TreeStarMan/116187139600668444,General Conflict,Anti-Iran,say care whether leader democratically elect fact happy democratically elect leader want select leader he think carefully roll floor laugh roll floor laugh roll floor laughing
