created_at,username,sentiment_text,url,subject_tag,stance_category,final_text
2026-03-07T23:29:46.949Z,tuckfrump,"#Belgium #operationepicfailure #iran #iranwar #gaza #israel #netanyahu #taco Belgium also says no to Trump’s war, that is besides Spain , some other countries that sound reluctant to join this stupid war are Italy , Germany and France, these last three have not decided yet but they know the consequences, a terrorist attack and a massive exodus of Middle Eastern refugees to Europe.https://substack.com/@rawstory/note/c-224459229?r=17qxua&amp;utm_medium=ios&amp;utm_source=notes-share-action",https://mastodon.social/@tuckfrump/116190490587597144,Military Action,Neutral,belgium also say trumps war besides spain country sound reluctant join stupid war italy germany france last three decide yet know consequence terrorist attack massive exodus middle eastern refugee europe
2026-03-07T23:22:20.068Z,RonSupportsYou,&quot;Massive war price tag could be a massive problem for GOP leaders. The prospect of a ballooning new spending bill has GOP leaders bracing for a messy internal fight&quot;: https://www.politico.com/news/2026/03/06/iran-war-cost-congress-republicans-00816079 #politics #IranWar,https://mastodon.social/@RonSupportsYou/116190461300706686,General Conflict,Neutral,massive war price tag could massive problem top leader prospect balloon new spending bill top leader brace messy internal fight
2026-03-07T23:12:15.293Z,RonSupportsYou,"You, @noncompliant, wrote: &quot;American soldiers are killing innocent women and children and I&#39;m suppose to be opposed to Russia helping Iran fight the most evil shit on the planet&quot;Yes, the most evil shit on the planet is what Russia is doing in Ukraine, now and for more than four years in a genocidal war. As many people know, Trump is #PutinsPuppet. What Trump is doing in the #IranWar helps Russia (by increasing oil prices and wasting American missiles). Both of those results also harm Americans.",https://mastodon.social/@RonSupportsYou/116190421666254752,Military Action,Anti-Iran,write american soldier kill innocent woman child suppose oppose russia help iran fight evil shit planet yes evil shit planet russia ukraine four year genocidal war many people know trump trump help russia increase oil price waste american missile result also harm american
2026-03-07T23:05:16.000Z,AntiracistHippie,NOW ON VERDANT SQUARE RADIO == NOW PLAYING == #GreenSocialist Notes with Howie Hawkins Episode 268  3/7/26 https://www.youtube.com/watch?v=YO8MhYK7GkE  #news #uspol #GreenParty #leftist #revolution #left #green  #socialist #anticapitalist #vsn #radio #HowieHawkins #geopolitics #antiimperialism #antifascist #iran #iranwar #ecuador #oil #indigenous #drugwar #colombia #bolivia #russia #palestine #gaza  #israel #genocide https://mastodon.social/@VerdantSquareRadio/116189906452202574,https://heads.social/@AntiracistHippie/116190394252012962,General Conflict,Neutral,verdant square radio playing note bowie hawkins episode
2026-03-07T23:04:35.828Z,RonSupportsYou,"&quot;One gets away with doing reckless, stupid things—like attacking Iran without a plan—-until the moment one doesn’t&quot;: https://www.lawfaremedia.org/article/the-situation--the-base-jumping-presidency Discussing the good and the bad things about the #IranWar as of today. #planning #luck #RunningOutOfLuck copy: @renewedresistance #politics",https://mastodon.social/@RonSupportsYou/116190391554891378,Military Action,Neutral,one get away reckless stupid thing like attack iran without plan moment one discussing good bad thing today copy
2026-03-07T22:46:52.000Z,saskboy,Peace Prize Pedo President is poised to push paratroopers into Persia.Perfect.#IranWar,https://mastodon.cc/@saskboy/116190321877388892,General Conflict,Anti-Iran,peace prize pedro president poise push paratrooper persia perfect
2026-03-07T22:45:11.989Z,PoetGreg,#SEVENTEEN #IranIsraelWar #Trump #TrumpEpsteinFiles #Iran #IranWar #IranIsraelWar #draft,https://mastodon.social/@PoetGreg/116190315281130510,General Conflict,Neutral,
2026-03-07T21:30:12.000Z,metro.co.uk,Man killed by falling debris after drone hits Dubai’s 23 Marina tower  https://fed.brid.gy/r/https://metro.co.uk/2026/03/07/man-dies-debris-drone-interception-hits-dubais-23-marina-tower-27289204/,https://fed.brid.gy/r/https://metro.co.uk/2026/03/07/man-dies-debris-drone-interception-hits-dubais-23-marina-tower-27289204/,Military Action,Neutral,man kill fall debris drone hit dubai marina tower
2026-03-07T20:45:56.000Z,metro.co.uk,Thousands protest against strikes on Iran at US Embassy in London  https://fed.brid.gy/r/https://metro.co.uk/2026/03/07/thousands-protest-strikes-iran-us-embassy-london-27288490/,https://fed.brid.gy/r/https://metro.co.uk/2026/03/07/thousands-protest-strikes-iran-us-embassy-london-27288490/,Protest/Activism,Neutral,thousand protest strike iran u embassy london
2026-03-07T22:40:33.000Z,CharlieMcHenry,"Trump’s White House Posts Fascist Memes As It Wrecks the Economy - “…the United States has now fully entered the “Drive-By Shooting Era” of US foreign policy. The Trump-Vance administration’s actions around the globe don’t feel like those of a functioning government in a healthy democracy, but rather those of addled suburban teens playing ‘Grand Theft Auto: Vice City,’ or “GTA,” cackling hysterically and chugging gallons of Pepsi as they mow down stretches of civilians…” https://zeteo.com/p/trump-iran-war-grand-theft-auto-memes #IranWar #ForeignPolicy #TrumpRegime #Trump #Republicans #RepublicansDidThis",https://connectop.us/@CharlieMcHenry/116190297009835321,General Conflict,Neutral,trump white house post fascist meme wreck economy united state fully enter drive shooting era u foreign policy trump vance administration action around globe do feel like function government healthy democracy rather addle suburban teen play grand theft auto vice city sta cackle hysterically chug gallon pepsi mow stretch civilian
2026-03-07T22:20:25.000Z,maxblumenthal,"RT: @dimitrilascaris Today in Toronto, I asked pro-Trump Iranians whether it bothered them that the U.S. military massacred more than 100 school-girls in Iran.This is what happened.#IranWar #Toronto",https://mastox.eu/@maxblumenthal/116190217890441360,General Conflict,Pro-Iran,today toronto ask pro trump iranians whether bother u military massacre schoolgirl iran happen
2026-03-07T22:11:26.000Z,BOOKidealist,"It feels almost like March 2020, with one bad news after another. #IranWar",https://bookstodon.com/@BOOKidealist/116190182507675292,General Conflict,Neutral,feel almost like march one bad news another
2026-03-07T21:55:46.000Z,pelicangut,"RE: https://fediscience.org/@petergleick/116189321935915921There's been a bit of this already, including Russian attacks on Ukraine. USA doing it now too. This is very bad and of course criminal.#USpol #IranWar",https://aus.social/@pelicangut/116190120930193662,Military Action,Neutral,bit already include russian attack ukraine u bad course criminal
2026-03-07T21:50:18.000Z,yogthos,Pressure on the Gulf states’ budgets could lead them to reassess their overseas investments and future commitments as they consider options to alleviate the financial strain caused by the US-Israeli war against Iran.https://www.dawn.com/news/1979302/gulf-countries-reviewing-us-investments-amid-iran-war#news #worldnews #iran #iranwar #usa,https://social.marxist.network/@yogthos/116190099435105986,General Conflict,Pro-Iran,pressure gulf state budget could lead reassess overseas investment future commitment consider option alleviate financial strain cause u israeli war iran
2026-03-07T20:24:38.000Z,israelhayom.com,Iran weakens faster than expected as US-Israel air campaign peaks  https://fed.brid.gy/r/https://www.israelhayom.com/2026/03/07/iran-weakens-faster-than-expected-as-us-israel-air-campaign-peaks/,https://fed.brid.gy/r/https://www.israelhayom.com/2026/03/07/iran-weakens-faster-than-expected-as-us-israel-air-campaign-peaks/,General Conflict,Anti-Iran,iran weaken faster expect u israel air campaign peak
2026-03-07T21:05:56.000Z,israelhayom.com,Who really runs Iran?  https://fed.brid.gy/r/https://www.israelhayom.com/2026/03/07/who-really-runs-iran-pezeshkians-humiliation-reveals-revolutionary-guards-power/,https://fed.brid.gy/r/https://www.israelhayom.com/2026/03/07/who-really-runs-iran-pezeshkians-humiliation-reveals-revolutionary-guards-power/,General Conflict,Anti-Iran,really run iran
2026-03-07T21:48:07.000Z,SpaceWrangler,@thetnholler.bsky.social If my toddler acted like this they would go into a time out. What an awful POS human. #embarrassing #uspolitics #IranWar,https://shakedown.social/@SpaceWrangler/116190090854644003,General Conflict,Neutral,ask social toddler act like would go time awful po human
2026-03-07T21:31:39.000Z,PariaSansPortefeuille,"""This is the first war since the Second World War that is directly impacting cities that we can consider hubs in the #globalEconomy."" #AmericanPrestige pod welcomes #EsfandyarBatmanghelidj to discuss the economic consequences of #Trump's #warOnIran https://americanprestigepod.com/episodes/5052012542 #Iran #IranWar #USpol #USforeignPolicy #USMiddleEastPolicy #régimeChangeWars #GulfStates #MiddleEast",https://jasette.facil.services/@PariaSansPortefeuille/116190026118094504,General Conflict,Anti-Iran,first war since second world war directly impact city consider hubs pod welcome discuss economic consequence
2026-03-07T21:30:56.000Z,BrianJopek,"With the bombing of the school and now this, the justification excuse of helping the people the FOTUS’s regime has used for attacking Iran is out the window. #USpol #IranWar “The Iranian Foreign Minister is claiming that the Epstein regime has just attacked a DESALINATION PLANT in Iran. If Iran responds in kind, the Middle East could become uninhabitable as there’s not enough fresh water for the populations to survive without their vulnerable desalination plants.” - The Resistance",https://mastodon.world/@BrianJopek/116190023287209791,Military Action,Pro-Iran,bomb school justification excuse help people forum regime use attack iran window iranian foreign minister claim epstein regime attack desalination plant iran iran respond kind middle east could become uninhabitable enough fresh water population survive without vulnerable desalination plant resistance
2026-03-07T21:13:44.000Z,jeridansky,"Why Today in Tabs is my favorite newsletter:Takes like this: Now that xAI has bought X dot com and SpaceX has bought xAI, SpaceX is a lean, mean space launch satellite internet social media AI CSAM-as-a-service machine. Or, as Musk describes it, “a sentient sun to understand the Universe and extend the light of consciousness to the stars!” And this: if you, like me, are feeling somewhere close to a personal nadir of despair lately Tabs Senior Contributing Editor Bijan has some advice:I think it's important and quietly radical to remember that evil is real and it does exist. ... Good exists, too. There is an us and there is a them. Don't become like them. Caring about each other is the only thing that will bring us into the future.Also: The latest newsletter also has a long rant about how the people running the war in Iran was just don't give a shit about the destruction they're causing. A brief quote wouldn't do it justice. https://www.todayintabs.com/p/they-don-t-care?_bhlid=66d997c1878a2ec650106d6969597bc013d87dc0#SpaceX #Iran #IranWar #uspol",https://sfba.social/@jeridansky/116189955641669685,General Conflict,Neutral,today tabs favourite newsletter take like mai buy dot com space buy mai space lean mean space launch satellite internet social medium camps service machine musk describes sentient sun understand universe extend light consciousness star like feel somewhere close personal nadir despair lately tabs senior contribute editor jan advice think important quietly radical remember evil real exist good exists u do become like care thing bring u future also late newsletter also long rant people run war iran do give shit destruction cause brief justice
2026-03-07T21:01:13.868Z,VerdantSquareRadio,NOW PLAYING == #GreenSocialist Notes with Howie Hawkins Episode 268  3/7/26 https://www.youtube.com/watch?v=YO8MhYK7GkE  #news #uspol #GreenParty #leftist #revolution #left #green  #socialist #anticapitalist #vsn #radio #HowieHawkins #geopolitics #antiimperialism #antifascist #iran #iranwar #ecuador #oil #indigenous #drugwar #colombia #bolivia #russia #palestine #gaza  #israel #genocide #EpsteinFiles #uk #peace #antiwar #DiverseSpectrumOfTheLeft #SupportIndependentMedia,https://mastodon.social/@VerdantSquareRadio/116189906452202574,General Conflict,Neutral,play note bowie hawkins episode
2026-03-07T20:46:57.000Z,daimon_erre,Make America Go Away.#US #iran #iranwar #carloslatuff,https://mastodon.uno/@daimon_erre/116189850353933157,General Conflict,Pro-Iran,make america go away
2026-03-07T18:52:21.000Z,metro.co.uk,Iran’s Assembly of Experts could meet to elect new supreme leader within 24 hours  https://fed.brid.gy/r/https://metro.co.uk/2026/03/07/irans-assembly-experts-meet-elect-new-supreme-leader-within-24-hours-27286869/,https://fed.brid.gy/r/https://metro.co.uk/2026/03/07/irans-assembly-experts-meet-elect-new-supreme-leader-within-24-hours-27286869/,General Conflict,Neutral,iran assembly expert could meet elect new supreme leader within hour
2026-03-07T20:40:12.000Z,newsbeep,Iranian-Americans rally in Washington for democracy amid U.S.-Israel military campaignWASHINGTON (Gray DC) – Iranian-Americans gathered in Washington on Saturday to rally for democracy in Iran as the…#NewsBeep #News #BreakingNews #AnaSami #AyatollahKhamenei #breakingnews #Dc #DonaldTrump #Iran #iranwar #IranianFuture #Iranian-Americans #iranians #Israel #POTUS #U.S.Iran #Washingtonhttps://www.newsbeep.com/423199/,https://newsbeep.org/@newsbeep/116189823805576351,Protest/Activism,Neutral,iranian american rally washington democracy amid u israel military campaign washington gray iranian american gather washington saturday rally democracy iran american iran
2026-03-07T20:34:24.000Z,camille,Media Is Lying To You About The Kurds https://youtu.be/wX9TjE4aYh0?si=hZCVQFhsbWSEQ8xd#Kurdish #Kurdistan #kurds #iranwar #handsoffiran,https://social.praxis.nyc/@camille/116189800981150654,General Conflict,Neutral,medium lie kurd
2026-03-07T20:34:13.928Z,DrALJONES,"Interview: &quot;Trump Has No Clear Plan on Iran&quot;: fmr US officials&quot;Before my resignation, [this]is exactly what I was warning against&quot;.~Hala Rharrit&quot;It is ludicrous to expect the American people to believe that Iran would have attacked the US preemptively in the middle of negotiations.&quot;And the contradictory messages from Trump et al. show “how little they were really thinking this through before they went to war.”~Jasmine El-Gamalhttps://www.democracynow.org/2026/3/5/iran_state_defense #USPol #EUPol #IranWar .",https://mastodon.social/@DrALJONES/116189800294308037,Military Action,Neutral,interview trump clear plan iran u official resignation exactly warn ala charr tit ludicrous expect american people believe iran would attack u preemptively middle negotiation contradictory message trumpet al show little really think go war jasmine elgar al
2026-03-07T20:33:31.682Z,DrALJONES,"Analysis: &quot;Israel planned this war on Iran for 40 years.&quot;Netanyahu:&quot;This combined effort allows us to do what I have hoped to achieve for 40 years: to crush the regime of terror completely. That&#39;s my promise &amp; this is what is going to happen&quot; ~Netanyahu&quot;For 40 years, each year has been proclaimed the very last opportunity to stop the &quot;mad mullahs&quot; from obtaining a bomb – a bomb that never materialised.&quot;~Jonathan Cookhttps://www.middleeasteye.net/opinion/israel-planned-war-iran-40-years-everything-else-smoke-screen#USPol #EUPol #IranWar #USIsraeliCrimes .",https://mastodon.social/@DrALJONES/116189797526350487,General Conflict,Neutral,analysis israel plan war iran yearsnetanyahuthis combine effort allow u hop achieve year crush regime terror completely promise amp go happen tanya year year proclaim last opportunity stop mad mullah obtain bomb bomb never materialise jonathan cook
2026-03-07T20:31:06.973Z,DrALJONES,"Interview: &quot;America’s War for Greater Israel&quot;Mouin Rabbani unpacks:* the explosive new documents exposing Israel’s systematic ethnic cleansing in 1948;* Trump&#39;s torpedoing of diplomacy at the very moment negotiations were gaining traction;* whether Tehran’s bombing of Gulf states is a strategic miscalculation;* how Israel&#39;s unending quest for security has fuelled decades of expansion, war &amp; regional upheaval.https://www.middleeastmonitor.com/20260303-americas-war-for-greater-israel-palestine-this-week-with-mouin-rabbani/ #USPol #EUPol #IranWar #USIMperialism .",https://mastodon.social/@DrALJONES/116189788043167731,General Conflict,Pro-Iran,interview americas war great israel ruin rabbi unpacks explosive new document expose israel systematic ethnic cleanse trump top diplomacy moment negotiation gain traction whether tehran bomb gulf state strategic miscalculation israel unending quest security fuel decade expansion war amp regional upheaval
2026-03-07T20:30:24.931Z,DrALJONES,"Analysis: &quot;The Iranian Revolutionary Guard is reverting to its guerrilla roots &amp; is operating with something like a cell structure.&quot;&quot;Iran is fighting a techno-guerrilla war, [while] the US &amp; Israel fight a conventional one&quot;&quot;Quite apart from its failure, the [war] tactic of killing civilian leaders is a war crime &amp; is unprecedented in modern warfare&quot;. Not even Putin re Zelenskyy.https://www.juancole.com/2026/03/fighting-guerrilla-conventional.html #USPol #EUPol #IranWar #news .",https://mastodon.social/@DrALJONES/116189785288095699,General Conflict,Pro-Iran,analysis iranian revolutionary guard revert guerrilla root amp operate something like cell structure iran fight techno guerrilla war u amp israel fight conventional quite apart failure war tactic kill civilian leader war crime amp unprecedented modern warfare even putin teen key
2026-03-07T20:28:52.292Z,tuckfrump,"#operationepicfailure #iran #iranwar #taco Every body warned about it , from the Washington post;“A classified report by the National Intelligence Council found that even a large-scale assault on Iran launched by the United States would be unlikely to oust the Islamic republic’s entrenched military and clerical establishment, a sobering assessment as the Trump administration raises the specter of an extended military campaign that officials say has “only just begun.”https://archive.is/2026.03.07-193951/https://www.washingtonpost.com/national-security/2026/03/07/iran-intelligence-report-unlikely-oust-regime/",https://mastodon.social/@tuckfrump/116189779214031850,General Conflict,Neutral,every body warn washington post classify report national intelligence council find even large scale assault iran launch united state would unlikely oust islamic republic entrench military clerical establishment sober assessment trump administration raise spectre extended military campaign official say begin
2026-03-07T20:28:03.460Z,DrALJONES,"Interview: &quot; We already are in a scenario where the US has lost control of this war&quot;&quot;Iran is the weaker party, but it has the capability to create a much longer mayhem than envisioned by the US &amp; Israel.&quot;~Political scientist Vali Nasrhttps://www.aljazeera.com/video/the-bottom-line/2026/3/4/iran-war-redrawing-the-map-of-the-middle-east-israeli-style #USPol #EUPol #IranWar #USImperialism #news #USIsraeliCrimes .",https://mastodon.social/@DrALJONES/116189776016441477,General Conflict,Neutral,interview already scenario u lose control war iran weak party capability create much long mayhem envision u amp israel political scientist valid nash
2026-03-07T20:27:09.912Z,DrALJONES,"&quot;Imperial blowback&quot;In 1953, Churchill &amp; his US counterparts &quot;launched a coup against the democratically elected Prime Minister of Iran, Mohammad Mosaddegh, because he was nationalizing the oil industry...&quot;&quot;... and when that [US-UK] regime was overthrown in the Iranian revolution in 1979, one of the main reasons that people gave for that revolution was the overthrow of Mosaddegh in 1953...&quot;~George Monbiothttps://www.youtube.com/watch?v=eQ54eG4DjX0&amp;t=128s #USPol #UKPol #EUPol #IranWar #Imperialism #BigOil .",https://mastodon.social/@DrALJONES/116189772507226392,General Conflict,Neutral,imperial blow backing churchill amp u counterpart launch coup democratically elect prime minister iran mohammad diego nationalizing oil industry usu regime overthrown iranian revolution one main reason people give revolution overthrow diego george mon
2026-03-07T20:25:59.582Z,DrALJONES,"Report: &quot;Classified U.S. Document Says Iran War Unlikely to Topple the Regime&quot;The document from late February doubts that Iran’s opposition would take power following either a short or extended U.S. military campaign.&quot;The document came from the National Intelligence Council, which is composed of &quot;veteran analysts who produce classified assessments meant to represent the collective wisdom of Washington’s 18 intelligence agencies.&quot;https://www.washingtonpost.com/national-security/2026/03/07/iran-intelligence-report-unlikely-oust-regime/ #USPol #EUPol #IranWar #TrumpLies .",https://mastodon.social/@DrALJONES/116189767896667061,General Conflict,Neutral,report classify u document say iran war unlikely topple regime document late february doubt iran opposition would take power follow either short extend u military campaign document come national intelligence council compose veteran analyst produce classified assessment meant represent collective wisdom washington intelligence agency
2026-03-07T19:59:28.000Z,OldSquida2,"“In Minab, near the Strait of Hormuz, a girls school was bombed, leaving 165 children dead. Yet most Americans cannot name the town where it happened, much less the name of a single one of those girls…That is because modern war depends on a hierarchy of grief, on training people to treat foreign children as an abstraction, a number, an unfortunate ‘incident’ to be denied, obscured or investigated at leisure…the only fact that matters: Children were killed in their classroom, and they were killed with violence made possible, materially and politically, by American power.”#IranWar #children #schoolbombing https://anabaptistworld.org/when-the-bombs-fall-on-other-peoples-children/",https://kolektiva.social/@OldSquida2/116189663616168995,General Conflict,Neutral,final near strait hormuz girl school bomb leave child dead yet american can not name town happen much less name single one girls modern war depend hierarchy grief training people treat foreign child abstraction number unfortunate incident deny obscure investigated leisure fact matter child kill classroom kill violence make possible materially politically american power
2026-03-07T19:55:03.000Z,fogolf,"https://www.fogolf.com/1185581/trump-looks-to-turn-attention-to-western-hemisphere-at-least-for-a-moment-at-americas-summit/ Trump looks to turn attention to Western Hemisphere, at least for a moment, at Americas summit #130850145 #article #Diplomacy #Donald #DonaldTrump #DonaldTrumpGolf #DonaldTrumpGolfing #GeneralNews #GovernmentPolicy #IranWar #Politics #trump #TrumpGolf #TrumpGolfing #WarAndUnrest #WashingtonNews #WorldNews",https://vive.im/@fogolf/116189646244530462,General Conflict,Neutral,trump look turn attention western hemisphere least moment americas summit
2026-03-07T19:44:57.000Z,990000,We’re living in hell. #Claude #IranWar #AI https://bsky.app/profile/justinling.ca/post/3mgi4xz4pv22xArticle: https://thisweekinworcester.com/exclusive-ai-error-girls-school-bombing/,https://mstdn.social/@990000/116189606574221185,General Conflict,Neutral,living hell
2026-03-07T19:37:12.000Z,AntiracistHippie,NOW ON VERDANT SQUARE RADIO == NOW PLAYING == Don Lemon Drop LIVE 3/7/26 - Trump's #Epstein Distraction #IranWar https://www.youtube.com/watch?v=puqILgJ3l7A #news #uspol #radio #BlackMastodon #lgbtq #culture #commentary #trump #resistance #DonLemon #journalism #freespeech #firstamendment #pressfreedom #vsn #progressivenewstalk #progressive #left #resistance #DiverseSpectrumOfTheLeft #SupportIndependentMedia #Resisthttps://mastodon.social/@VerdantSquareRadio/116189422851976027,https://heads.social/@AntiracistHippie/116189576066677524,General Conflict,Neutral,verdant square radio playing lemon drop live trump distraction
2026-03-07T19:12:36.000Z,CharlieMcHenry,‘Operation Epstein Distraction’: Trump’s bloody Iran ‘hype videos’ seem to target niche audience https://www.theguardian.com/us-news/2026/mar/07/trump-iran-hype-videos #IranWar #EpsteinFiles #USPol #USPolitics #RepublicansOwnThis,https://connectop.us/@CharlieMcHenry/116189479353663140,General Conflict,Neutral,operation epstein distraction trump bloody iran hype video seem target niche audience
2026-03-07T19:11:06.893Z,miki_lou,"&quot;Policy choices, not market forces of a war halfway around the world, explain the spike in prices...leading to unnecessary economy-wide #inflation and higher interest rates.&quot; https://www.thestar.com/business/opinion/trumps-war-on-iran-hasnt-altered-canadas-cost-of-making-gas-at-all-so-why/article_4cd48522-31f5-4249-92da-37bbede816c9.html  #IranWar #Uspol #BigOil #WarMachine #cdnpoli",https://mastodon.social/@miki_lou/116189473464819404,General Conflict,Neutral,policy choice market force war halfway around world explain spike price lead unnecessary economy wide high interest rate
